{
  "allowed_post_review_delta": [
    {
      "allowed_generated_verification_artifact": true,
      "path": "verification/current-canonical-verification-report.json"
    },
    {
      "allowed_generated_verification_artifact": true,
      "path": "verification/current-canonical-verification-report.md"
    },
    {
      "allowed_generated_verification_artifact": true,
      "path": "verification/llm-verification-report.json"
    },
    {
      "allowed_generated_verification_artifact": true,
      "path": "verification/llm-verification-report.md"
    }
  ],
  "allowed_post_review_delta_sha256": "5450928986c7195b7d74c9a7574bcdfacbd0c034106bb9ea27d6382d15e2cd1f",
  "report_envelope_commit": "d9f3e9b0ca1f1e5ef739d7af510b1598d99f1fbb",
  "report_envelope_tree": "b5cde93674dc4249ddd67f131728b002673e3a37",
  "reviewed_source_commit": "62eb0b2371ae70668d0693cf7cb22bf6f075c74d",
  "schema_version": "source-verification-envelope-v1",
  "subject_unchanged": true,
  "verification_subject_manifest": [
    {
      "bytes": 57,
      "path": ".gitattributes",
      "sha256": "e53eab9377d22464106dc7ddc50e5be36d1af0ed4ef77cea295bc33f9d0463c7"
    },
    {
      "bytes": 1835,
      "path": ".github/workflows/ci.yml",
      "sha256": "9385cbf69034322e77f58819029ebb3c41eaf393ae963a23043e337ed3e4f439"
    },
    {
      "bytes": 666,
      "path": ".gitignore",
      "sha256": "da6f4498db1e1e8e9bafd9b46e721e010ab86501a90b88314a1831082c9a6a57"
    },
    {
      "bytes": 29320,
      "path": "AGENTS.md",
      "sha256": "7025d9682d3c11e6fc7bd31067213f9bfd228e4ba301f1cfe2e407a8a51c0dae"
    },
    {
      "bytes": 386,
      "path": "CODE_OF_CONDUCT.md",
      "sha256": "f0ec97134a81918c75c4d4359911aeb17662f457b072e97752644c7ea7f5c4c8"
    },
    {
      "bytes": 4853,
      "path": "CONTRIBUTING.md",
      "sha256": "e3c67bde83fca31680351ae0f3b2da6234846cdc3d941788dd9e65f77a76860b"
    },
    {
      "bytes": 11357,
      "path": "LICENSE",
      "sha256": "c71d239df91726fc519c6eb72d318ec65820627232b2f796219e87dcf35d0ab4"
    },
    {
      "bytes": 18510,
      "path": "README.md",
      "sha256": "e92f3c4523a051041cdab73d4b395c793cf374632ae5ca582133d6a3739445f9"
    },
    {
      "bytes": 1062,
      "path": "REPRODUCE.md",
      "sha256": "1f2cfdc5133cc9a8526b6bdb3ce41c308dc4b825ca3a69c9144cb172b57d45fd"
    },
    {
      "bytes": 2639,
      "path": "SCORING-MODEL.md",
      "sha256": "c5fd86c79abc04ca2c68077d1b8367b5c38411f14b0ee5a8b3c26f811d5cce47"
    },
    {
      "bytes": 1005,
      "path": "SECURITY.md",
      "sha256": "0f286256ad2a472cd987d774e7afccbbb4b846f1c80c5f0a81e8464dacba96f5"
    },
    {
      "bytes": 122271,
      "path": "SPEC.md",
      "sha256": "f5388638dbc1c7fbea55d99d5dbd8d1206b4ab1ca23bfeba37cf2a6e10b70d73"
    },
    {
      "bytes": 468,
      "path": "SUPPORT.md",
      "sha256": "dffd51fdf6e7228dd4b0b762362f53e57f9e3816a0d4898d33e7e5ec20437d49"
    },
    {
      "bytes": 6439,
      "path": "configs/canonical-three-repetition.toml",
      "sha256": "2a138d61158f943442aeb6ead0e125c9da60c7c1556b291be411bb3b769ce08a"
    },
    {
      "bytes": 5874,
      "path": "configs/default.toml",
      "sha256": "277b59fc061b2760772259451b3fea583f506ebd771a6b75fbd57e7140d5b5a3"
    },
    {
      "bytes": 1910,
      "path": "configs/fresh-final-arm-retry-v2.json",
      "sha256": "62cc82ef999734d27050be8a6d1eb8a5a4fedd52d9debf8529b41998b2148d87"
    },
    {
      "bytes": 2535,
      "path": "configs/issue-486-three-arm-canary.toml",
      "sha256": "fe41b16b7d1c126a692ce29e3fb126c92554010b1dd5ccade21f41900933372e"
    },
    {
      "bytes": 2601,
      "path": "configs/methodology-policy.json",
      "sha256": "4f5606e8de6e032666cc70f3351df89cf91691a6b6c7fe200d82f27e2f4a6239"
    },
    {
      "bytes": 1071,
      "path": "configs/methodology-vnext.json",
      "sha256": "f07ac01dfd25551b58adb94e12ab5a1f1db5f34d32e4d8fc080c22fb2e838084"
    },
    {
      "bytes": 451,
      "path": "dashboard/index.html",
      "sha256": "d891512b29cdba3ef7dde5b2b04d7a411f639a6317567ffb048832023645f069"
    },
    {
      "bytes": 133397,
      "path": "dashboard/package-lock.json",
      "sha256": "b3c4f1e90a5f6090f98298fd897242967727de5e3f24c5c85bfb630b186a91b9"
    },
    {
      "bytes": 673,
      "path": "dashboard/package.json",
      "sha256": "11b720aac254d399b428d0186e23f988a915c8a5d0ea4b697401259a5f1613f2"
    },
    {
      "bytes": 278,
      "path": "dashboard/playwright.config.ts",
      "sha256": "55f10629c8d2ccf0ef4fd898ade2834946258176871667a558249a1525803f80"
    },
    {
      "bytes": 18764,
      "path": "dashboard/src/analysis.ts",
      "sha256": "028a0c3396282c6d4b3d961f9c63e7d1034802f34d72aecb7152811c00de362a"
    },
    {
      "bytes": 14319,
      "path": "dashboard/src/main.tsx",
      "sha256": "a07c2c7fcf434a298438b94930e1d0ce8020f081e244f70ce67b2f4e05df42fc"
    },
    {
      "bytes": 3125,
      "path": "dashboard/src/metric-descriptors.json",
      "sha256": "5a7d9c20819d059b8fc61358ec929da988569e05565690935e93527314d7d349"
    },
    {
      "bytes": 2424,
      "path": "dashboard/src/styles.css",
      "sha256": "6107e31ef83c4ab5cfda468db0ef84fe030c4c84b713a14f47b605ebc4ea994a"
    },
    {
      "bytes": 38,
      "path": "dashboard/src/vite-env.d.ts",
      "sha256": "65996936fbb042915f7b74a200fcdde7e410f32a669b1ab9597cfaa4b0faddb5"
    },
    {
      "bytes": 9089,
      "path": "dashboard/tests/analysis.test.ts",
      "sha256": "00c1b0f35b4d50a479ed8e423a7f6335bd9cf8d991b8e7833b2257d7c8ad55cf"
    },
    {
      "bytes": 6700,
      "path": "dashboard/tests/browser.spec.ts",
      "sha256": "2d6863c6fa866eff1e1262b1baaf6998606b9c378b2d0cfe606eaee807820dfa"
    },
    {
      "bytes": 576,
      "path": "dashboard/tests/hardening-v2.test.ts",
      "sha256": "ae59336634fe3bfe6e16c5e04f6251ebae901b4da0f7bececef5e52831e53732"
    },
    {
      "bytes": 459,
      "path": "dashboard/tsconfig.json",
      "sha256": "5dadad42f2299aa9f15b605165494423274a7c3bc11cf36b5be27142c014066a"
    },
    {
      "bytes": 317,
      "path": "dashboard/vite.config.ts",
      "sha256": "b6acd308eeff76fc92f11c0bd4a9a03bba16bcd893b7561ad6ed5e5adebef694"
    },
    {
      "bytes": 1614,
      "path": "docs/SAME_SOURCE_RECOVERY.md",
      "sha256": "610a7ea4af24a5e53e45569c79424505a67743203325bc63080bea4c57f472b7"
    },
    {
      "bytes": 2438,
      "path": "docs/adr/0003-operational-and-attribution-model.md",
      "sha256": "f883ce34e1749909f7996964392224614c19e1e9430e6fd257557d182795e79b"
    },
    {
      "bytes": 2792,
      "path": "docs/benchmark-hardening-map.md",
      "sha256": "ca367841f9ac1e7317958dd5b9c06189c20c8722f889729048d318985a094ebf"
    },
    {
      "bytes": 2144,
      "path": "docs/benchmark-independent-review-checklist.md",
      "sha256": "f6801e64ede36a9c8e78d05337a5a072aa4c07353a486730e7d5f4777ad6422f"
    },
    {
      "bytes": 3879,
      "path": "docs/llm-maintenance-verification.md",
      "sha256": "d6723d99c5383f4042dba0ebcd2e0e507c8b9a6569f6d72108ecdc59e628679a"
    },
    {
      "bytes": 7379,
      "path": "docs/methodology.md",
      "sha256": "df756a04363466b213e0a8161ab9a9998e23ecb8b08fed2427b10666c8eb0484"
    },
    {
      "bytes": 1487,
      "path": "docs/operational-dashboard.md",
      "sha256": "76714a56ee3953d52f932de4939d3762b3a5b8d2f7bfb8fa8b945daa11c30102"
    },
    {
      "bytes": 943403,
      "path": "docs/prompt-history-traceability.md",
      "sha256": "be720379a8295548c31823dc696d333bd14dd4aadbfe8ee12ee77c48540534b9"
    },
    {
      "bytes": 1641,
      "path": "docs/publication-supplement-implementation-audit.md",
      "sha256": "401aaab42a3cffef74407d65dcacbdef2a349eb7b8a7607b925c0660253ecf3d"
    },
    {
      "bytes": 2439,
      "path": "docs/repeated-matched-analysis.md",
      "sha256": "bb15eb1003f753b51dc7aae06584dcb69c182dc616478a74a3252f9555b67e5a"
    },
    {
      "bytes": 1778,
      "path": "docs/report-field-glossary.md",
      "sha256": "33d809744b654ead461d27610b17ac0a92627cf2b8927d08a61b8a90996b6dfb"
    },
    {
      "bytes": 2860,
      "path": "docs/result-schema.md",
      "sha256": "057156bcb5475c0524f65c8f328f673b4dbf000a5cfd6c3a12a22c698370c1ff"
    },
    {
      "bytes": 1066,
      "path": "docs/review-handoff.md",
      "sha256": "6441b57355c10063d99b121967e7b872038ebb2da0a8b52c615a72db24f84729"
    },
    {
      "bytes": 1093,
      "path": "docs/schema-v3-hardening-note.md",
      "sha256": "7924971909db987ae8133f81cace3ec4658774ee28aef437d492c420e1be8df9"
    },
    {
      "bytes": 50515,
      "path": "docs/spec-compliance.md",
      "sha256": "241d878c388801ebd99b95625453e3647acc35e23d09aec1d7f60b2e4d2bc9bb"
    },
    {
      "bytes": 1258,
      "path": "docs/statistical-limitations.md",
      "sha256": "bf0bfef471fd55e4f9424a423a89d257f1c1dbd76a495d6128a39e3ce5ddddb5"
    },
    {
      "bytes": 1249,
      "path": "docs/token-accounting-v2.md",
      "sha256": "8236ec2bb8431601560f963059781e41e39fc7a59e5290291d511e8fb0c2579b"
    },
    {
      "bytes": 3523,
      "path": "docs/variant-synthesis.md",
      "sha256": "364fb669a1287ee2216136d4e330e6318360e5d521124d0e8e245f81e3ebdcc3"
    },
    {
      "bytes": 14027,
      "path": "docs/verification-registry.md",
      "sha256": "bce3161d661c05dc5157d93437e16a33ad921a36ef478b15d711218c91b09f48"
    },
    {
      "bytes": 9301,
      "path": "examples/custom-suite.toml",
      "sha256": "7102da5dc927acfd9c85cf9bb2153ca386dc0024797014ed86abf23386a66fbd"
    },
    {
      "bytes": 1566,
      "path": "fixtures/methodology-vnext/issue-486-requirements.json",
      "sha256": "c932b590f9ab45b3eff78434a5cb3cd8d00a78ee6325ecce0fe8c5e7421ea1a2"
    },
    {
      "bytes": 1558,
      "path": "fixtures/methodology-vnext/issue-488-requirements.json",
      "sha256": "a963d56772e83c96ba2d22ae7b846f284a7d0b7662383a3936c4fc5ae66435b2"
    },
    {
      "bytes": 1656,